{
  "id": "rotated-memory-x-cdep-v1",
  "title": "Rotated Memory X under circuit depolarizing noise",
  "observable": "logical_x",
  "noise_model": "circuit_depolarizing",
  "input_type": "stim-detector-error-model",
  "p_list": [
    0.005
  ],
  "rounds_policy": {
    "kind": "distance-scaled",
    "multiplier": 1,
    "minimum": 3
  },
  "collection": {
    "max_shots": 100000,
    "max_errors": 1000
  },
  "result_metrics": [
    "logical_error_rate"
  ],
  "execution_status": "real"
}
